clinical_text,disease
My chest feels like I ' m by a knife. It ' s breathe deeply lie down. I can only get some relief I sit down and forward. I also have pain in my left shoulder and dry cough. I very anxious and palpitations. I also have a high temperature.,Mediastinal Changes
"Have run out of, and, behold, a and, and have trodden my; and are warmed, but I don ' know they come from.",Mediastinal Changes
"I came down few days ago. I had a nose and a sore flesh. I also felt some swelling in my lymph neck. They were all over my body, not just my. They were solid and steady, and they ' move I pressed them. I was afraid that it would be a sign of cancer.",Mediastinal Changes
"'I had a fever and sweating night for a while, and a cold, a nose inflammation, a throatache, a my neck and elsewhere, wanted to know if I was suffering lymphoma or other serious diseases.'",Mediastinal Changes
"'I have sick for a long time. I have a fever and night sweats. I also have a cold with a nose a sore throat. I felt some bumps in my and other parts of body. They were swollen lymph. were hard fixed, and grew quickly. I thought it might be lymphoma or some other condition.'",Mediastinal Changes
'I have a very painful headache. It me dizzy and sick. I also have loss of. I can see nothing in the center my vision. weakness and numbness in both legs. I have difficulty and understanding others.',Mediastinal Changes
"'Have nose, a sore throat, and a. I also swollen nodes throughout my body. They are and painful, and they growing quickly. am scared that have cancer or lymphoma.'",Mediastinal Changes
"I've been sick for a long time, and I have fever, sweat at night, cold, nose snot, throat pain, neck and other parts of my body, lymph swollen, hard, fixed, fast, and I think it could be lymphoma or something serious.",Mediastinal Changes
"'Though I had made me, and kissed me, I kissed my head. I saw all the evil things that was on my head, and there was no strength in my heart. I don\'t know that there is no strength in my heart.""'",Mediastinal Changes
"'I have a cold a runny nose, a sore, and a fever. I have lymph all over my body. They are hard painful, they are fast. I am worried that I cancer lymphoma.'",Mediastinal Changes
Have a bad headache. It makes dizzy and nauseous. also have weakness and in my left arm and legs. I can ' t move them well. I loss of. I can ' t see anything my left.,Mediastinal Changes
"I have sharp and prickly pain in my chest, and it hurts when, swallow or. Sit down lean forward and feel better. I lie down, I can ' t breathe. When cough and have, I get hot, it tickles and anxiety.",Mediastinal Changes
There ' s a sharp pain in my back and neck that doesn ' t go. It hurts more when I breathe deeply lie on my bed. I feel better when I prop up with some. I ' ve been feeling very tired have a - grade fever. I also noticed some in my ankles and.,Mediastinal Changes
"I terrible headache, I feel someone ' knocking on my head, and I can see it. see light and color flashes, I have weaknesses and numbness on my right, and can ' speak understand else.",Mediastinal Changes
"I a pain in my chest, severe when coughing or swallowing. It ' s hard lie, I have to sit and. I have and dry. ' m very anxious and weary.",Mediastinal Changes
I a headache that is very. It me dizzy and nauseous. I also have a weakness and in my arm. I can ' t move them well. I also have a vision loss. I can ' t anything my left side. I have difficulty and understanding others.,Mediastinal Changes
"I've had a fever and night sweat for a while, and I also have a cold with the nose of the runaway and a sore throat, and the lymph nose swelling in my neck and elsewhere, which is solid and ulcer, and growing fast, and I wonder if you have lymphoma or other serious illness.",Mediastinal Changes
"'For I am, as a rush fire. am full eyes, so that I can \' t face. I can \' t go and see where I am, neither can I know where I came from? ""'",Mediastinal Changes
"Have a serious insecurity that makes fall a lot. I have a very serious. makes me see stars, . My left arm and are weak and. I can ' speak understand else.",Mediastinal Changes
"Is acute pain in, neck shoulder. It more when I or flat. I can ' sleep well because of the pain and difficulty in breathing.",Mediastinal Changes
"Have sharp and prickly in my chest, and it hurts more when I cough, or breathe. down and lean forward feel. I down, I can ' t breathe. When I cough and have a, I get hot, it tickles and anxiety.",Mediastinal Changes
"'My head hurts to, it hurts to death, it hurts death, it cries to death, it is blind, , it is, is numb on both sides of my, is hard to and it is hard to understand.'",Mediastinal Changes
I feel very and in my arm and leg. I can ' t them properly. I also have constant headache that won ' t go away. My vision is blurry and ' t see clearly. I don ' what ' s wrong me.,Mediastinal Changes
Have a severe that very painful. It makes me dizzy and sick. also have a vision loss. I can ' t anything in center of my vision. I also have a weakness and numbness both and legs. I have trouble speaking understanding.,Mediastinal Changes
"My hurts a lot. It ' s a and stabbing pain that gets worse when I swallow, cough or down. It feels better when I sit up lean. I have a fever, cough and anxiety. have trouble and palpitations.",Mediastinal Changes
"I ' ve been feeling very uncomfortable lately my nose, throat, my fever, swollen, is difficult and, and I that may have.",Mediastinal Changes
I a severe headache that is intense. It makes me cry and scream. I also have loss. I can ' t see anything the corners of vision. also a weakness and numbness in both sides my face. I have speaking and understanding others.,Mediastinal Changes
Have a unsteadiness that makes me stumble and trip. I also have a headache that is very bad. It me see flashes and spots. I also have and in right arm and leg. I ' t or others well.,Mediastinal Changes
I have a weakness and numbness in both sides of my face. I can ' move them well. have a headache that is very. me cry and scream. also have a loss of vision. I don ' t see anything in the corners my vision. find it difficult to and understand others.,Mediastinal Changes
"'For weeks, I have had fever sweat, and I have cold, a nose, a sore, swollen and other places, hard, fixed, fast - growing lymphoma or other serious diseases, want to know I have or any other serious.'",Mediastinal Changes
I have a rash nose and a ulcer and a fever. I also swollen a lymph necklace throughout my body. It's hard and painful and it grows fast. I'm afraid to suffer from cancer or lymphoma.,Mediastinal Changes
"I ' ve got sharp pain my that hurts more I breathe deeply, or lie flat. It ' s better when I up and lean forward. I have a cough, fever and. I also have breathing, palpitations and swelling in my legs and feet.",Mediastinal Changes
"'I have a pain in my chest that gets worse when I lie down or breathe. I sit down and forward. I have a pain in my back, neck, my left. have a dry cough trouble breathing when I lie down. I feel so tired and worried. I fever and swelling my legs and legs.'",Mediastinal Changes
"'Is a light in the night, and in night; but I am like a. There is no place in me; shall healed, neither shall there be any remaining; and they me, shall be dismayed.'",Mediastinal Changes
I have a severe that makes me fall down a. also have a headache that very bad. makes me stars and black. I also have a weakness and my left arm leg. I can ' t speak or understand others well.,Mediastinal Changes
"'Have been feeling for a long time. I have a fever and night sweats. I also have a cold with a runny nose a sore throat. I have swollen lymph neck and elsewhere. They are hard and fixed, they are fast. I think I might have or another condition.'",Mediastinal Changes
"'Have had a and night sweats for a while. I also have a cold with a runny nose a sore throat. swollen lymph nodes my neck and other places. hard and painful, and they growing rapidly. I wonder I have lymphoma or another serious disease.'",Mediastinal Changes
"For back is true, that I can ' t go from them. I sleep on my bed, found a deep sleep on my bed, my are, I have feet again.",Mediastinal Changes
"'I have a sharp and stabbing pain in my chest that hurts more I lie cough. I have to sit and lean forward to feel better. also have pain in my back, neck, shoulder. I a dry cough and trouble breathing when I lie down. I feel very tired and anxious. I have a and swelling in my legs and.'",Mediastinal Changes
I have severe headache that very painful. It me dizzy sick. I also have vision loss. I can ' t see the center my vision. I also have a weakness and numbness in both arms legs. have trouble speaking and understanding others.,Mediastinal Changes
"I ' ve been having this pain in my chest that ' s sharp and stabbing. It worse when I cough, , or lie flat. I feel more comfortable I sit up and lean. also have trouble breathing when I lie down. I have a dry cough a fever. Sometimes I feel beating and get nervous.",Mediastinal Changes
"'I have been very. I a running nose, throat, and a fever. have also that lymph are swollen throughout my body. They are difficult and painful touch.'",Mediastinal Changes
"I swollen lymph nodes all my body. They hard, they grow up fast. ' m I have cancer or.",Mediastinal Changes
"I ' ve very uncomfortable lately nose, my, my fever, lymph swollen, touch is difficult and painful, and I fear I may.",Mediastinal Changes
"'For the past few weeks, I have had and a. I also have a bad cold with nose and a throat. When I checked my neck, I felt some lumps that were hard and growing fast. think they are lymph nodes. it be?'",Mediastinal Changes
"There's a sharp and stabbing pain in my chest that hurts more when I cough, swallow, or take deep breaths. It feels better when I sit up and lean forward. I have difficulty breathing when I lie down. I also have a fever and a dry cough. I have palpitations and anxiety too.",Mediastinal Changes
I and numbness in and leg. I ' t move them. I also have a headache that is very bad. It makes me dizzy and nauseous. I also have a vision loss. I can ' t see anything on my left. I have trouble speaking understanding others.,Mediastinal Changes
"'I have a cold with, a sore, and a fever. I also have lymph nodes all over my body. They are and fixed, they growing fast. am that I have cancer or lymphoma.'",Mediastinal Changes
"'I have a sharp and stabbing pain chest that hurts more when lie flat or cough. I have to sit up and lean forward to feel better. also have in my, neck, left shoulder. I have dry cough and trouble breathing when I lie down. I feel very tired and anxious. I fever and swelling in my legs and feet.'",Mediastinal Changes
"'Had a fever and sweating at night for while, and I also had a cold, a nose and, around my neck elsewhere, which was difficult and painful and growing rapidly, and I wanted to know if I was suffering from lymphoma other diseases.'",Mediastinal Changes
'Also have loss of vision. I see nothing at the my vision. also have a and in both arms and legs. I it difficult speak and others.',Mediastinal Changes
"There ' a of stabbing in my chest that worse when I deep or I lie down. I better down lean forward. I also have a pain in my back, my neck, my left shoulder. I have a dry cough and a, I a throbbing and anxiety.",Mediastinal Changes
"I had a terrible headache yesterday. It was bad that ' t anything. also felt very weak and my left side. tried to talk my wife, but she I was slurring my words. I was so confused and scared.",Mediastinal Changes
"'Have more abundantly than all men, because they are more than men, and have not prevailed against, neither have I it, neither was there any me; I have seen with my arm, and my, and my arm.'",Mediastinal Changes
"My right arm and right leg are weak and numb, I can't move them, I have a severe headache, I faint and vomit, I lose my vision, I can't see anything on my right, I can't talk, I can't understand others.",Mediastinal Changes
"My chest feels like it's being stabbed by a knife. The pain is worse when I lie down or take deep breaths. I have to sit up and bend forward to ease the pain. I also have a dry cough, a fever and anxiety. My legs, feet and ankles are swollen.",Mediastinal Changes
"Am small and very weak. I can ' t go over in the, or by the arm of his right. I can ' wherever goes. I ' t where there is no.",Mediastinal Changes
I have a headache and. I feel someone ' knocking at my. I also difficulty. I see flashes of light and. I also weakness and numbness on my right side.,Mediastinal Changes
"'Have been feeling for a long time. I have a fever and night. I also have cold with a runny and a sore throat. I have swollen lymph nodes in neck and other parts of. They are hard painful, and they are growing. I think I might have lymphoma or another serious condition.'",Mediastinal Changes
"There ' s a and stabbing in chest that hurts more when I cough, swallow, take deep breaths. It feels better I sit up and lean forward. I have breathing when I down. I also have fever and a dry cough. I have palpitations and.",Mediastinal Changes
Have a weakness numbness in my right arm leg. can ' t them well. I a headache that very bad. makes me faint and vomit. I also have a vision loss. I can ' t see anything on my right side. I have trouble speaking and understanding others.,Mediastinal Changes
"'I have more abundantly than all men, because they are more than all men, and have not prevailed against me, neither have I seen it, neither was there any harmful thing in me; I have seen with my arm, and with my strength, and with my arm.'",Mediastinal Changes
"'For the past few weeks, had night and a fever. also have a bad cold with a runny nose and a sore. I checked my neck, I felt some lumps that were hard and growing fast. I are lymph nodes. Could it lymphoma?'",Mediastinal Changes
I a weakness and in sides of my face. I can ' t move well. I also have a headache that is very bad. It makes cry and. I also have a loss. I can ' t see anything in the corners my vision. I trouble and understanding others.,Mediastinal Changes
"'Have more abundantly than all men, because they more than all, and not prevailed against me, neither I, neither was there any harmful thing in; I have seen my arm, and with my strength, with my arm.'",Mediastinal Changes
"For my ark is too sharp for me. I a sharp. I can ' lie down. I, and I am wrath.",Mediastinal Changes
"'I was sick a long time ago, I had a fever and sweaty night, and I also had a cold a sore throat, and I some my neck and other of my body. The lymph necklace was puffy. It was solid and steady, and it grew fast, and thought it might be a or serious condition.'",Mediastinal Changes
'There is acute pain in my back and neck that does not go away. It hurts more when I breathe deeply or lie flat on my bed. I feel better when I dress with pillows. I have been very tired and have a low fever. I also noticed swelling in my ankles and feet.',Mediastinal Changes
"There ' a stabbing pain in chest that gets worse when breathe deeply or lie down. It ' s better sit up and bend forward. I also have pain in back, neck, and shoulder. have a dry and fever. I also have palpitations and anxiety.",Mediastinal Changes
"My days are like a weaver's shut up by a rod, when I sit down to the prey; when I bow down, my feet put in water, and my feet are asleep, so that I can't go with my feet, and my feet are sunk in pieces.",Mediastinal Changes
"My chest ' s being stabbed by a knife. It hurts more when I cough, swallow, or take breaths. It feels better when I sit up and lean forward. have difficulty I lie down. I also have a fever a cough. I have palpitations anxiety too.",Mediastinal Changes
I have and numbness both arms and legs. I ' t move them well. I also have a that is very. It makes me sweat and shake. I also have a loss. can ' t see anything the center of my vision. I have trouble speaking and understanding.,Mediastinal Changes
"My like it ' s being stabbed by a knife. It hurts when cough, swallow, or take deep. feels better when up and lean forward. I have difficulty breathing when I down. I have a fever and a dry cough. I have palpitations and anxiety too.",Mediastinal Changes
"The last few weeks, ' ve had night sweat and fever, I ' m very my nose running and ulcers. When checked my neck, I felt some hard and fast growing tumors. I it ' lymph nose. it be lymphoma?",Mediastinal Changes
There ' s a sharp pain in my and neck that doesn ' t away. hurts more when I breathe deeply or lie flat on my. I better I prop myself up with some. I ' ve feeling very tired and I have a low - grade fever. I noticed some swelling in my and feet.,Mediastinal Changes
"My chest hurts so much, it ' s a severe pain and it gets I lie down or cough, I have to sit and lean feel better, I feel pain in my back, my neck, my left shoulder, I have a cough a fever, my heart beats and I.",Mediastinal Changes
"'Have a with a runny, a sore throat, and a. I also have swollen lymph nodes all my body. They are and, and they are growing fast. am worried that cancer or lymphoma.'",Mediastinal Changes
"'I was also light by night, and there was a light in the night, and I was as a tempest in the night: I saw no place in my head, neither was there any strength in me; I wondered, and I felt in it.'",Mediastinal Changes
"I ' ve been having this sharp and chest pain that gets worse when I cough, or lie flat. feels better I up forward. I have trouble, a dry cough, a fever and fatigue. My heart is beating fast and.",Mediastinal Changes
"'I have been very sick lately. I have a runny nose, a throat, and a fever. I also noticed my all over my body. They are and painful touch. I am worried that I might cancer or something.'",Mediastinal Changes
"I have pain in my chest, it hurts even more when I, swallow or down. I ' m better when I ' sitting up and leaning forward. ' s hard to when I ' lying. I ' m hot when I cough and have a. ' m nervous.",Mediastinal Changes
I ' ve been having speaking lately. I can ' t form the words want to. I also get easily and things. I have a severe headache that in my temples. My vision is also affected. I and dark spots.,Mediastinal Changes
"I can ' t go from him, but I will make myself an of dry things, and will bring evil him, even the vision that I have spoken; and I speak righteousness and justice just; neither shall know any more, that I am he can.",Mediastinal Changes
"I ' ve been sick for a time, have fever, I sweat at night; I have cold, I a, I have throatache; I have lymphoma, it ' s hard, it ' s painful, it ' s. I might have lymphoma or something.",Mediastinal Changes
"'I have been sick for a long time. I have fever and night sweats. I also have a with a runny nose and sore. felt some bumps my neck and parts my body. They were swollen lymph nodes. They were hard and fixed, they quickly. I thought it might be lymphoma or some other serious condition.'",Mediastinal Changes
"'There is a light in the night, and cold the; but I am storm. There no place in me; I shall not healed, neither shall there be any; and if they hear me, dismayed.'",Mediastinal Changes
"'Have a sharp and stabbing pain in chest that hurts when lie flat or cough. I have to sit up and lean forward to feel better. also have pain in my back, neck, and left shoulder. I a dry cough trouble breathing when I down. I feel very tired and anxious. I have fever and swelling in legs and feet.'",Mediastinal Changes
"I ' ve had fever and night sweat a while, and I have cold with the nose of runaway and a ulcer in the, and I swollen the lymph nose in my neck and elsewhere, and it ' solid and painful, and it ' growing fast, I wonder if I a lymphoma or another serious disease.",Mediastinal Changes
"My chest a lot. ' s a sharp stabbing pain that gets worse when swallow, down. feels better when I sit up and forward. I have a fever, a dry cough and anxiety. also have trouble breathing and palpitations.",Mediastinal Changes
I have a severe headache and. It feels like someone is hammering my. I also have seeing. see flashes of light and colors. I also have a weakness and numbness in my. I can ' t speak or understand.,Mediastinal Changes
There ' s a sharp in my back and neck doesn ' t go away. It hurts when I take deep breaths or lie on my bed. I when I prop myself up with some pillows. I ' ve been feeling very and I have low - grade fever. I noticed some swelling in my ankles feet.,Mediastinal Changes
Feel very weak and in my right and leg. I can ' t move them properly. also have a constant that won ' t go away. My is and I can ' see clearly. I ' know what ' s wrong with me.,Mediastinal Changes
I have a constant headache that is very severe. makes me dizzy and. I also have a loss. can ' t see on my left side. I have a weakness numbness in arm and leg. I difficulty speaking and understanding others.,Mediastinal Changes
"I come and strike all my crown. I and my head. I see, am full of light. can ' t know it. can ' t find it. can ' t other man ' s understanding.",Mediastinal Changes
"'I have set mine head upon mine head for all things have sinned, and have not grieved, nor my arm faint: have not seen the vision of this vision, have seen any thing that is right mine eyes.'",Mediastinal Changes
"'I have been sick lately. I have a runny nose, a sore throat, and a fever. I also that my nodes swollen all over my body. are hard and. I am worried that I have cancer or something.'",Mediastinal Changes
I have a weakness and numbness in my left arm and leg. I can ' t move them well. I have a is very bad. me nausea. also have a loss of vision. I don ' t see anything on my left side. I it difficult to talk and understand.,Mediastinal Changes
Suffer from severe unsteadiness. I can ' t straight without falling over. I have a weakness and numbness in left arm leg. have a terrible headache that makes me. My vision is also impaired. I double and sometimes at all.,Mediastinal Changes
"'I got a recently. I had, a sore throat, and a fever. I also saw my lymph nodes enlarged and hard. They were all over my body, not in my neck. They were fixed and growing fast. I afraid that it cancer or like that.'",Mediastinal Changes
"My left arm and left leg are weak numb, I ' t move them, I a headache, get dizzy and sick, I lose eyesight, I can ' see on my left, I can ' t talk and I can ' t understand else.",Mediastinal Changes
'I a headache that is very bad. It makes see halos and shadows. I also a weakness and numbness in both of my face. I cannot.',Mediastinal Changes
"'I have had a fever and night sweats a while. I also have a cold with a runny and a throat. I have swollen nodes in my and other places. They are hard and painful, are growing rapidly. I wonder if I lymphoma or another.'",Mediastinal Changes
"'I a cold recently. I had a runny, sore throat, a fever. I also saw that my lymph nodes and. They were all over body, not just in neck. They were fixed and growing fast. I was afraid it was cancer or something like that.'",Mediastinal Changes
"Chest feels like it ' s being stabbed by a. pain is worse when I lie down or deep breaths. I sit up and bend forward to ease the pain. I also have a dry cough, a fever and anxiety. , feet and ankles.",Mediastinal Changes
"I a, I feel someone ' s knocking on my head, and I hardly see it. I see light color flashes, have weaknesses and my right, and I can ' t speak or anyone else.",Mediastinal Changes
"My headaches severe, my dizzyness makes dizzy and sick. My arm and my left leg are weak numb, and I ' move very. I lose my eyesight. ' t see anything on my left side. It ' s hard for me to talk and understand people.",Mediastinal Changes
"'When I speak, I am not in the belly, yet in my belly: I lie down, and I am not sick; I am full of heat, but I am full of heat.'",Mediastinal Changes
"I thought to have been long time with me, to behold, a little cold and: I wouldn ' t have on, it were possible, wouldn ' t respect face of any man.",Mediastinal Changes
I a weakness and numbness in sides my. I can ' t move them well. I also have a headache that is very bad. It makes me cry scream. I also have a loss vision. don ' t anything in the corners of vision. I find it difficult to speak understand others.,Mediastinal Changes
There ' a sharp pain in my back and neck that doesn ' t go away. It more when or lie flat on my bed. I feel better when prop myself up some pillows. I ' ve feeling very tired and I have a low - grade. I also noticed some swelling in ankles and feet.,Mediastinal Changes
"I am small and very weak. I can't go over in the right hand, or by the arm of his right. I can't show myself wherever he goes. I don't know where there is no vision.",Mediastinal Changes
I have a severe unsteadiness that me sway and wobble. I also have headache is very bad. It makes me see and shapes. also a and numbness in arms legs. can ' t speak or understand others well.,Mediastinal Changes
"'I have had a fever and night sweats for a while. have a with runny nose and a sore throat. I lymph nodes in my neck and other places. They are hard and, they are growing rapidly. I wonder if have lymphoma or another disease.'",Mediastinal Changes
"I have lymph nodes all over my body. are and fixed, and they fast. I ' m I or.",Mediastinal Changes
"When I remember, I am. I see. When I, I am full of wrath. When sit, ' m with feet. I have made stumbling, and stumbling block to my.",Mediastinal Changes
"'For the past few weeks, I have had night sweats and a fever. also have a bad with a nose and a throat. When I checked my neck, I felt some lumps that growing. think they are swollen lymph nodes. Could it lymphoma?'",Mediastinal Changes
'I have been experiencing severe for the past weeks. often lose balance and fall. I also trouble speaking and understanding people say me. Sometimes I get sharp pain in head that makes me lose my vision.',Mediastinal Changes
